{"artifacts":[{"artifact_id":"artifact.observations","content_path":"results/raw.csv","content_sha256":"f064f9b6e4e735225deb93ec34aacd9d431933f4b0e1cae0f06f238383f558c3","manifest_sha256":"fbc00bc91f57f09bfbab19359d9e2a250a58fb1d9b5eb86bbc10b579674a3119","media_type":"text/csv"}],"configuration":[{"canonical_sha256":"5d3709feaaeb60594a0efa1d6d70061b8eb8ec15ddcb35494c71a9bb880a544a","content_type":"application/json","name":"monte-carlo-pi.config"}],"created_at":"2026-10-12T12:00:19Z","environment":[{"key":"python.version","redacted":true,"redacted_value_or_digest":"3.14.6","tool_version":"3.14.6"}],"execution_claim":{"mode":"external_only","status":"imported"},"experiment_id":"experiment.monte-carlo-pi","metrics":[{"metric_sha256":"5845fbc1053ff396f8057950c0bf53cb232f666f41ecb3f51576af89f137771e","name":"analytic_target","unit":"ratio","value":3.141592653589793}],"model_identity":[{"name":"analytic.monte-carlo-pi","revision":"pilot.v1","source_sha256":"a6037af28bc1d235c9f1aa9c0896a886103f3417cc14f7a36780927ea854a2ff"}],"provenance_id":"provenance.monte-carlo-pi","provenance_sha256":"dcb31bea2c8121d84a3c71eaee5c2e5ba6233a6d23476d14b774e237be4adc94","qualification_receipts":[],"run_id":"run-00000000-0000-4000-8000-000000001193","runner":{"command_digest":"48707505fb7b58541f97afe890bb14e8a001767de492e0cf94ef58d06c5de809","finished_at":"2026-10-12T12:00:19Z","host_digest":"52888d2574ff2f157d92a6fabdec2f21167f6443409734e57c08d6ca94ff3619","identity":"runner.public-stdlib-cpu","started_at":"2026-10-12T12:00:19Z"},"schema_version":"arw.experiment-provenance.v1","source_datasets":[{"access_state":"locally_supplied","content_sha256":"e5d7abc5b24f912f9f30ca956e02a5b5095de772fd92baf28591534520cfb387","manifest_sha256":null,"uri_or_path":"input/config.json"}],"source_manifest_sha256":["a08ca2173dbde7fe3fb28d3adb6f6524aeaadb4f68ac9d78709fc6e88fde5293"]}
