{"artifacts":[{"artifact_id":"artifact.observations","content_path":"results/raw.csv","content_sha256":"adc69d25bea6055e0a955ad51717a52ca3153bc496e5d3ab2fa9e16b17babbe2","manifest_sha256":"d558a469e3a5fd950a788c2681dd23e2bd4fce86617aca4ee5220b593d7909c0","media_type":"text/csv"}],"configuration":[{"canonical_sha256":"e775deb279e79a6ebec952428012cdc5ac55572661099f1fc3ffbf1c8d462a08","content_type":"application/json","name":"finite-difference.config"}],"created_at":"2026-10-12T12:00:18Z","environment":[{"key":"python.version","redacted":true,"redacted_value_or_digest":"3.14.6","tool_version":"3.14.6"}],"execution_claim":{"mode":"external_only","status":"imported"},"experiment_id":"experiment.finite-difference","metrics":[{"metric_sha256":"061901017e27c4e3f7e849fb1d580ee65660c071125c8718b46810c50b17ac85","name":"analytic_target","unit":"ratio","value":1.0}],"model_identity":[{"name":"analytic.finite-difference","revision":"pilot.v1","source_sha256":"fed20d2890e92a1e1fb2028f61dc0dd1b4bb34b381abaac1e7b97d48ac4a48b0"}],"provenance_id":"provenance.finite-difference","provenance_sha256":"6b884d828314748daefebf78a3829515093ebd89d3c9c95e8df8916105606d09","qualification_receipts":[],"run_id":"run-00000000-0000-4000-8000-000000001192","runner":{"command_digest":"48707505fb7b58541f97afe890bb14e8a001767de492e0cf94ef58d06c5de809","finished_at":"2026-10-12T12:00:18Z","host_digest":"52888d2574ff2f157d92a6fabdec2f21167f6443409734e57c08d6ca94ff3619","identity":"runner.public-stdlib-cpu","started_at":"2026-10-12T12:00:18Z"},"schema_version":"arw.experiment-provenance.v1","source_datasets":[{"access_state":"locally_supplied","content_sha256":"fff5f0941a9c626f36a1ff3017e83cee71cf4e8ae0b4c168d4ca956104a37473","manifest_sha256":null,"uri_or_path":"input/config.json"}],"source_manifest_sha256":["b1aa774593c5bda112286a26122f33279945f545303d449518c254118a9e3845"]}
